<?xml version="1.0" encoding="UTF-8"?>
<xs:schema xmlns:xs = "http://www.w3.org/2001/XMLSchema">
    <xs:element name = "students">
        <xs:complexType>
            <xs:sequence>
                <xs:element ref="student" maxOccurs="unbounded" />
            </xs:sequence>
        </xs:complexType> 
    </xs:element>
    <xs:element name="student">
        <xs:complexType>
            <xs:sequence>
                <xs:element name="name" type="xs:string"/>
                <xs:element name="address" maxOccurs="unbounded">
                    <xs:complexType>
                        <xs:simpleContent>
                        <xs:extension base="xs:string">
                            <xs:attribute name="type">
                                <xs:simpleType>
                                    <xs:restriction base="xs:string">
                                    <xs:enumeration value="permanent"/>
                                    <xs:enumeration value="temporary"/>
                                    </xs:restriction>
                                </xs:simpleType>
                            </xs:attribute>
                        </xs:extension>
                        </xs:simpleContent>
                    </xs:complexType>
                </xs:element>

                <xs:element name="phone">
                    <xs:simpleType>
                        <xs:restriction base="xs:int">
                            <xs:pattern value="\d{10}"/>
                        </xs:restriction>
                    </xs:simpleType>
                </xs:element>
                <xs:element name="website" type="xs:string"/>
            </xs:sequence>
        </xs:complexType>
    </xs:element>
</xs:schema>